{
  "$schema": "https://json-schema.org/draft/2020-12/schema",
  "title": "LLM Wiki SPDX Draft SBOM",
  "type": "object",
  "additionalProperties": false,
  "required": [
    "$schema",
    "artifact_kind",
    "generated_at",
    "producer",
    "source_command",
    "source_revision",
    "source_tree_fingerprint",
    "input_fingerprints",
    "schema_version",
    "artifact_status",
    "retention_policy",
    "encoding",
    "currentness",
    "spdxVersion",
    "dataLicense",
    "SPDXID",
    "name",
    "documentNamespace",
    "creationInfo",
    "documentDescribes",
    "artifact_context",
    "packages",
    "relationships"
  ],
  "properties": {
    "$schema": {
      "type": "string",
      "enum": [
        "ops/schemas/spdx-sbom-draft.schema.json"
      ]
    },
    "spdxVersion": {
      "type": "string",
      "enum": [
        "SPDX-2.3"
      ]
    },
    "artifact_kind": {
      "type": "string",
      "enum": [
        "spdx_sbom"
      ]
    },
    "generated_at": {
      "type": "string",
      "pattern": "^\\d{4}-\\d{2}-\\d{2}T\\d{2}:\\d{2}:\\d{2}Z$"
    },
    "producer": {
      "type": "string"
    },
    "source_command": {
      "type": "string"
    },
    "source_revision": {
      "type": "string"
    },
    "source_tree_fingerprint": {
      "type": "string"
    },
    "input_fingerprints": {
      "type": "object",
      "additionalProperties": {
        "type": "string"
      }
    },
    "schema_version": {
      "type": "integer",
      "minimum": 1
    },
    "artifact_status": {
      "type": "string",
      "enum": [
        "current",
        "archived",
        "stale",
        "unknown"
      ]
    },
    "retention_policy": {
      "type": "string",
      "enum": [
        "ephemeral",
        "canonical_report",
        "archive"
      ]
    },
    "encoding": {
      "type": "string",
      "enum": [
        "utf-8"
      ]
    },
    "currentness": {
      "$ref": "#/$defs/currentness"
    },
    "dataLicense": {
      "type": "string",
      "enum": [
        "CC0-1.0"
      ]
    },
    "SPDXID": {
      "type": "string",
      "enum": [
        "SPDXRef-DOCUMENT"
      ]
    },
    "name": {
      "type": "string"
    },
    "documentNamespace": {
      "type": "string"
    },
    "creationInfo": {
      "$ref": "#/$defs/creationInfo"
    },
    "documentDescribes": {
      "type": "array",
      "items": {
        "type": "string"
      },
      "minItems": 1
    },
    "artifact_context": {
      "$ref": "#/$defs/artifactContext"
    },
    "packages": {
      "type": "array",
      "items": {
        "$ref": "#/$defs/package"
      }
    },
    "relationships": {
      "type": "array",
      "items": {
        "$ref": "#/$defs/relationship"
      }
    },
    "annotations": {
      "type": "array",
      "items": {
        "$ref": "#/$defs/annotation"
      }
    },
    "metadata": {
      "type": "object"
    }
  },
  "$defs": {
    "currentness": {
      "type": "object",
      "additionalProperties": false,
      "required": [
        "status",
        "checked_at"
      ],
      "properties": {
        "status": {
          "type": "string",
          "enum": [
            "current",
            "stale",
            "unknown",
            "invalid"
          ]
        },
        "checked_at": {
          "type": "string",
          "pattern": "^\\d{4}-\\d{2}-\\d{2}T\\d{2}:\\d{2}:\\d{2}Z$"
        }
      }
    },
    "creationInfo": {
      "type": "object",
      "additionalProperties": false,
      "required": [
        "created",
        "creators"
      ],
      "properties": {
        "created": {
          "type": "string",
          "pattern": "^\\d{4}-\\d{2}-\\d{2}T\\d{2}:\\d{2}:\\d{2}Z$"
        },
        "creators": {
          "type": "array",
          "items": {
            "type": "string"
          },
          "minItems": 1
        }
      }
    },
    "artifactContext": {
      "type": "object",
      "additionalProperties": false,
      "required": [
        "artifact_set_id",
        "model_ref",
        "cyclonedx_ref",
        "openvex_ref"
      ],
      "properties": {
        "artifact_set_id": {
          "type": "string"
        },
        "model_ref": {
          "type": "string"
        },
        "cyclonedx_ref": {
          "type": "string"
        },
        "openvex_ref": {
          "type": "string"
        }
      }
    },
    "externalRef": {
      "type": "object",
      "additionalProperties": false,
      "required": [
        "referenceCategory",
        "referenceType",
        "referenceLocator"
      ],
      "properties": {
        "referenceCategory": {
          "type": "string"
        },
        "referenceType": {
          "type": "string"
        },
        "referenceLocator": {
          "type": "string"
        }
      }
    },
    "package": {
      "type": "object",
      "additionalProperties": false,
      "required": [
        "SPDXID",
        "name",
        "versionInfo",
        "downloadLocation",
        "filesAnalyzed",
        "primaryPackagePurpose",
        "externalRefs"
      ],
      "properties": {
        "SPDXID": {
          "type": "string"
        },
        "name": {
          "type": "string"
        },
        "versionInfo": {
          "type": "string"
        },
        "downloadLocation": {
          "type": "string"
        },
        "filesAnalyzed": {
          "type": "boolean"
        },
        "primaryPackagePurpose": {
          "type": "string",
          "enum": [
            "APPLICATION",
            "LIBRARY"
          ]
        },
        "licenseConcluded": {
          "type": "string"
        },
        "licenseDeclared": {
          "type": "string"
        },
        "externalRefs": {
          "type": "array",
          "items": {
            "$ref": "#/$defs/externalRef"
          }
        }
      }
    },
    "relationship": {
      "type": "object",
      "additionalProperties": false,
      "required": [
        "spdxElementId",
        "relationshipType",
        "relatedSpdxElement"
      ],
      "properties": {
        "spdxElementId": {
          "type": "string"
        },
        "relationshipType": {
          "type": "string",
          "enum": [
            "DESCRIBES",
            "DEPENDS_ON"
          ]
        },
        "relatedSpdxElement": {
          "type": "string"
        }
      }
    },
    "annotation": {
      "type": "object",
      "additionalProperties": false,
      "required": [
        "annotationType",
        "annotator",
        "annotationDate",
        "comment"
      ],
      "properties": {
        "annotationType": {
          "type": "string"
        },
        "annotator": {
          "type": "string"
        },
        "annotationDate": {
          "type": "string",
          "pattern": "^\\d{4}-\\d{2}-\\d{2}T\\d{2}:\\d{2}:\\d{2}Z$"
        },
        "comment": {
          "type": "string"
        }
      }
    }
  }
}
